id,data_criacao,titulo,cidade,estado,tipo_problema,resolvido:bool,conteudo,tipo_postagem,ordem_da_interacao,tipo_interacao,id_pai,nome_completo_empresa,nome_curto_empresa,site_empresa,categoria_empresa
y-i90CDCumbiQLMC,2017-01-24,Concessionária Roma Peugeot (Rua Uruguai - Rio de Janeiro) se nega a ressarcir prejuízos por ela causados ao consumidor.,Rio de Janeiro,RJ,Problema mecânico,False,"Venho através deste canal de comunicação tentar descrever todos os fatos ocorridos na compra do nosso carro Peugeot 208 griffe branco nácre automático 2016 / 2017 na concessionária Roma Peugeot, no Rio de Janeiro. Inicialmente gostamos muito do carro visto que eu e minha esposa tínhamos um Peugeot 208 griffe automático 2015/2015 e queríamos efetuar a compra deste novo modelo apenas pelas atualizações que vimos no site da Peugeot .



Tanto queríamos o novo modelo, que toda a negociação foi feita com o vendedor senhor Edimar via telefone e inclusive todos os dados repassados através de ficha, enviada via e-mail. Antes da realização da compra não nos foi oferecido teste drive para o modelo do carro, nem mesmo nas inumeras vezes em que estivemos na concessionária Roma Peugeot. No momento da compra erraram na elaboração do contrato de compra do veículo e nenhum funcionário explicou com exatidão as funcionalidades do carro. Sempre quando eu e minha esposa estivemos presentes na concessionária o senhor Edimar que nos vendeu o carro nunca esteve presente, inclusive no dia da retirada do carro. Sempre éramos atendidos por funcionários de outro setor e que estavam completamente desconfortáveis em nos explicar algo que não tinham domínio. Uma vergonha. No dia em que fomos retirar o carro, o funcionário senhor Fábio do setor de vendas, nos auxiliou no intuito de ajudar a sanar as dúvidas de forma bastante educada, porém o mesmo era de outro setor, portanto não era sua área de atuação.



Ao sair com o veículo O KM da concessionária ROMA PEUGEOT, cerca de 30 metros o sensor de estacionamento dianteiro esquerdo começou a disparar sem a presença de nenhum obstáculo físico em sua frente e o mesmo persistiu e não parou. Por questões de segurança trafeguei com o carro até um posto de abastecimento de gasolina e desliguei o carro através da chave do comando do carro. E seguida, volte a ligar e dei partida no motor, verifiquei que a anormalidade havia encerrado. Desta forma prossegui com o meu deslocamento até a Zona Sul do Rio de Janeiro pois tinha um compromisso bastante importante, e dai o problema voltou a ocorrer. Minha esposa ligou para a concessionária e falou com a senhora Suzana e a mesma solicitou que o carro fosse levado para a oficina na próxima semana a fim de fazer uma inspeção. Quando chegamos em casa, fui tentar FAZER o espelhamento do celular no kit multimídia do Peugeot 208 griffe ano 2016/2017 automático, comprado na Roma PEUGEOT e não funcionou de forma alguma. Tentei em quatro diferentes aparelhos celulares (sony Z5 premium, LG 4 stylus e Sansumg J7 e Sansumg S7), todos sem sucesso. Antes de comprar o veículo em questão o site da Peugeot no Brasil menciona que é possível o espelhamento do celular no kit multimídia sem fazer qualquer restrição de modelos de aparelhos celulares, SERIA ISSO UMA PROPAGANDA ENGANOSA? 

O técnico da empresa, senhor Vinícius passou um aparelho no sistema eletrônico do carro e nada foi encontrado, após sair com o carro da agência. Por alguns dias o carro não apresentou mais o problema do sensor de estacionamento dianteiro esquerdo.



No dia 29 de Dezembro de 2016 eu e minha esposa viajamos do Rio de Janeiro até o estado do Espírito Santo e percebemos que o kit multimídia do veículo desligou e ligou involuntariamente por 4 vezes, sem qualquer ação de nossa parte, mais parecendo um problema técnico, o vício oculto, podendo gerar um acidente ou nos direcionar a locais indevidos e com falta de segurança para os passageiros do veículo em questão. Durante a mesma viagem percebemos que, com os ocupantes fora do carro e o mesmo totalmente destrancado, o porta malas não abria de forma alguma, só de acordo com a própria vontade do carro que ele abria, absurdamente inexplicável.



Após comparecer na concessionária Roma Peugeot na Rua Uruguai na Tijuca, na presença do gerente senhor Marcelo, foram instalados os seguintes acessórios originais da Peugeot no nosso carro: frisos laterias da cor branca e módulo de levantamento dos vidros com comando na chave. Após a instalação tudo ocorreu bem. Porém hoje, dia 10 de Dezembro de 2017 na período da tarde fui levar a minha esposa no shopping para ir ao salão, quando acionei o procedimento de abertura de portas normalmente, verifiquei que nenhuma luz auxiliar do carro estava acesa involuntariamente, quando girei a chave do comando do carro o kit multimídia ligou e não consegui dar a partida no carro, o mesmo não deu sinal. Todas as luzes acenderam, tais como a luz do salão, faróis, lanterna e etc. Ao tentar fechar os vidros através do telecomando da chave canivete do veículo a janela dianteira esquerda foi a única que não fechou por completo.



Resumo:



Diante dos fatos narrados, minha esposa foi obrigada a se locomover através do sistema de transporte Uber até o local de destino e a nota será apresentada caso se faça necessário , pois temos um bem novo e o mesmo não funciona e assim também ocorreu no regresso para a nossa residência.

O mais grave de tudo é que o consumidor quando compra um carro zero KM (compra no dia 02/12/2016) e em um pouco mais de 1 mês já foram vários problemas e quando necessitamos do carro com 38 dias de comprado para viajar com o veículo em questão não se move 1 cm para frente. Estávamos com uma viagem já programada para 10 dias a partir do dia 11/01/2017 e a programação seria ir de carro, veja seria ir de carro, isso se um carro zero KM comprado no dia 02/12/2016 não parasse de funcionar. Agora eu e minha esposa tivemos que arcar com as despesas de transporte aéreo, pois a PEUGEOT NOS DEIXOU NA MÃO COM UM CARRO COM 1200KM RODADOS E COM 38 DIAS DE RODAGEM. Que inclusive já apresentou problemas elétricos desde o primeiro dia de uso do veículo.



Sinceramente estou com medo de sair com esse carro e apresentar um problema em uma estrada deserta no Brasil ou em qualquer lugar que apresente risco a minha família. Caso isso ocorra, a PEUGEOT VAI NOS ABANDONAR DA MESMA FORMA COMO ESTÁ FAZENDO NESTE MOMENTO????? Se isso acontecer a quem vamos pedi ajuda? Para a Peugeot????? A mesma que faz propaganda enganosa???????? A mesma que vende carros ao consumidor e com um pouco mais de 1 mês o carro não liga???????? A PEUGEOT que entrega o carro ao consumidor com o manual de garantia sem a assinatura de garantia e carimbo do estabelecimento? A mesma concessionária que pede sem qualquer cerimônia, para o cliente mentir na pesquisa? Esse item não configura a garantia do cliente ao carro comprado, ou seja erro primário. Isso é função da empresa e não do cliente consumidor - ERRO PRIMÁRIO!!!!!!!!!!!! Tantos erros que sinceramente estou com medo do modelo de carro Peugeot 208...



Queria que o nosso ponto de vista em relação a Peugeot e ao carro 208 melhorasse, pois tenho até medo de viajar com esse modelo de carro...



A perguntar que fica, é certo o consumidor arcar com despesas que não são de suas responsabilidade, uma vez que seu carro quebra e não recebe nenhum suporte por parte da Peugeot ou da Roma Peugeot do Rio de Janeiro?



Quando pensamos em comprar um carro, pagamos um preço bem mais elevado, porém compramos a qualidade de ser um carro que nunca foi utilizado, peças novas, garantia e a seriedade de que as peças e a marca são de extrema confiança. Acho que todas essas qualidades são desprezíveis, quando depois de 38 dias da compra de um carro zero km o mesmo não sai do lugar.



Neste momento me sinto prejudicado, ofendido moralmente e prejudicado materialmente.



No dia do acontecimento eu e minha esposa ligamos para o senhor Marcelo (gerente da Roma Peugeot) explicando a situação e ele mencionou que não poderia ajudar devido ao horário, porém deixamos claro que pelo carro ser extremamente novo nunca pensaríamos que o carro não iria sair do lugar com problema mecânico. O gerente da Roma Peugeot foi pedindo tempo para tentar solucionar o problema e nada de respostas até que no sábado dia 14/01/2017, minha esposa ligou para o senhor Marcelo (gerente da Roma Peugeot) e o mesmo de forma e postura bastante diferente de quando fomos comprar o carro, informou que nada seria feito por parte da Roma Peugeot, mesmo assim minha esposa com toda educação pediu gentilmente o nome do responsável em se recusar a fazer um acordo em ressarcir os nossos danos e o mesmo de forma indiferente e pouco simpática,mencionou QUE FOI O GRUPO ROMA PEUGEOT. Solicitamos por ligação e mensagem via whatsapp que o sr. Marcelo respondesse nosso email, enviado na quinta-feira, 12/01/17 pela manhã, e ele simplesmente respondeu que poderia responder, mas seria em outro dia. Absurdo um gerente ser simpático para vender e depois de concluida a venda, tratar o cliente com tamanha indiferença e má vontade.



Ou seja, a Roma Peugeot começou a criar transtorno desde o dia que compramos esse carro e culminou com a desastrosa QUEBRA DO VEÍCULO APÓS A INSTALAÇÃO DE UM ACESSÓRIO NA CONCESSIONÁRIA ROMA PEUGEOT. TUDO ISSO GEROU UM ESTRESSE, POIS COM HOTEL PROGRAMADO, VIAGEM PROGRAMADA E NOSSO MEIO DE LOCOMOÇÃO NÃO FUNCIONANDO NO MÍNIMO ESTRESSA QUALQUER PESSOA QUE COMPRA UM CARRO 0 KM.



Eu e minha esposa tivemos que arcar com despesas com passagens de avião, táxis, UBER e aluguel de carro. Com todos esses itens que não estavam previstos, tivemos muitos gastos que foram causados pela TOTAL FALTA DE RESPEITO E COMPROMETIMENTO DESSA CONCESSIONÁRIA. Tudo ocorreu mediante a quebra do nosso carro 0 KM comprado na ROMA PEUGEOT E NÃO TIVEMOS NENHUM SUPORTE POR PARTE DO SENHOR MARCELO (GERENTE), NO DIA E NA HORA DA ANORMALIDADE...POIS ELE QUERIA QUE LEVASSEMOS O CARRO NA CONCESSIONÁRIA NO DIA SEGUINTE. 

Agora de que forma eu levaria o carro se o mesmo não saía do lugar e eu viajaria na madrugada do dia do problema ocorrido? Eu e minha esposa viajariamos de carro e eu certo local encontraríamos com dois casais de amigos que também iriam de carro nos seguindo. Ou seja, uma confusão enorme no momento em que vimos o nosso carro naquele estado, após dias de programação da nossa viagem.



É JUSTO COM O CONSUMIDOR QUE PLANEJA SUAS FÉRIAS, TER A PREOCUPAÇÃO QUE NA GARAGEM DE SEU IMÓVEL TEM UM CARRO 0km QUEBRADO E NO MEIO DE SUA VIAGEM EM QUE DEVERIA RELAXAR APÓS OS ESTRESSES DO DIA A DIA, NÃO CONSEGUIR POR TER QUE RESOLVER PROBLEMAS CAUSADOS POR UMA CONCESSIONÁRIA QUE SE JULGA SéRIA E CONFIÁVEL. E QUE A FALTA DE SENSIBILIDADE, RESPEITO PELO CLIENTE E BOM SENSO DA PEUGEOT ROMA CONTINUA NOS CAUSANDO TANTO ESTRESSEE PREJUÍZOS, JÁ QUE A DIRETORIA DO GRUPO ROMA PEUGEOT SE NEGA A NOS RESSARCIR MESMO O GERENTE MARCELO TENTANDO UM ACORDO COM ELES, VISTO O GRANDE PROBLEMA QUE NOS CAUSARAM?
FICA CLARO QUE A ROMA PEUGEOT TEM CIÊNCIA DE QUE NOS CAUSARAM INÚMEROS PREJUÍZOS, UMA VEZ QUE DURANTE TROCAS DE MENSAGENS ENTRE NÓS E O GERENTE DA ROMA PEUGEOT FICA EVIDENTE A TENTATIVA DELE JUNTO AO GRUPO ROMA EM FAZER UM ACORDO CONOSCO. 
AGORA FICA A PERGUNTA: SE NÃO A ROMA PEUGEOT NÃO É RESPONSÁVEL POR NOSSAS DESPESAS E PREJUÍZOS, PORQUE LEVARAM 3 DIAS TENTANDO RESOLVER?



Nota:

Antes da entrega do nosso carro, houve um problema na elaboração da proposta de compra por parte da PEUGEOT e com isso, tivemos que pegar o carro dias além do marcado. Fomos abordados pelas senhora Suzana (supervisora) e senhor Marcelo (gerente) e os mesmos nos perguntaram se foi oferecido teste drive do modelo do carro na concessionária Roma Peugeot na loja, no mesmo momento eu e minha esposa respondemos de forma firme e honesta (NÃO), O gerente e supervisora citados anteriormente, NOS PEDIRAM PARA MENTIR NA AVALIAÇÃO DA CONCESSIONÁRIA PERANTE A PEUGEOT DO BRASIL, POIS ISSO PODERIA SER MUITO MAL VISTO PELO FABRICANTE. VEJA ISSO, COMO PODEMOS ACREDITAR EM UMA EMPRESA QUE PEDE PARA O CLIENTE MENTIR PARA GARANTIR BONS RESULTADOS PERANTE A PEUGEOT DO BRASIL?????





Pontos que a concessionária não atende os requisitos mínimos para venda de veículos:



1 - Quando marcaram conosco para fazer a venda do carro e no dia ninguém sabia o que fazer durante venda.



2 - Durante a entrega do veículo pediram para o cliente mentir. Supervisora Suzana e gerente Marcelo, já informado no texto acima



3 - Lamentavelmente a concessionária cometeu um erro primário, de entregar o manual do proprietário sem carimbo e assinatura da concessionária, assim não garantiu-se a garantia de 3 anos do veículo.



4 - O carro logo ao sair da concessionária apresenta problema após 10 min da entrega. Problemas no sensor de estacionamento dianteiro, problema ainda continua.



5 - O espelhamento do celular não funciona no kit multimídia do veículo e o site da peugeot do Brasil indica o contrário.



6 - Em diversas vezes o porta malas do carro tem problemas para abrir.



7 - O kit multimídia desliga várias vezes enquanto o carro está em movimento.



8 - O veículo não liga por nada ****** gravíssimo. DESTA FORMA COMO O CARRO É AUTOMÁTICO O MESMO NÃO SE MOVIMENTA E O GERENTE SENHOR MARCELO, NEM SE OFERECEU PARA LEVAR O CARRO PARA A OFICINA DA ROMA PEUGEOT, ASSIM MINIMIZANDO O PROBLEMA. AO CONTRÁRIO, ELE SUGERIU QUE NO DIA SEGUINTE LEVASSEMOS O CARRO ATÉ A CONCESSIONÁRIA E SÓ APÓS ISSO ENTÃO VIAJARIAMOS.

Vergonhosamente absurdo!!!!!!!!!!!!



9 - O gerente senhor Marcelo (ROMA PEUGEOT) demonstrou descaso, pois se comprometeu a ligar na quinta-feira dia 12/01/2017 até o fim do dia independente da posição, não cumpriu... Ligamos e ele novamente se comprometeu a ligar na sexta dia 13/01/2017 até o fim do dia e também não o fez...Novamente ligamos e ele pediu para nos ligar até as 12 hs de sábado dia 14/01/2017 e mais uma vez não cumpriu o combinado. Enviamos uma mensagem e ele disse que nada será feito por ordem da diretoria do GRUPO ROMA PEUGEOT!!!!!!!!!!!!!!!!!!!!!!!!!!!!!!!!





É ASSIM QUE A PEUGEOT TRATA SEUS CLIENTES?

QUEM VAI PAGAR OS MEUS PREJUÍZOS FINANCEIROS NÃO PROGRAMADOS?



LAMENTAMOS MUITO TER QUE PASSAR POR ESSE CONSTRANGIMENTO MORAL E MATERIAL, POIS POR CULPA DA ROMA PEUGEOT FOMOS OBRIGADOS A DISPONIBILIZAR RECURSOS FINANCEIROS QUE A QUEBRA DO CARRO NOS LEVOU A EXECUTAR. DESTA FORMA O CONSUMIDOR É RESPONSÁVEL POR ERROS DA CONCESSIONÁRIA ?



QUE EMPRESA É ESSA QUE TRATA O CLIENTE ASSIM?

SINCERAMENTE QUANDO COMPRAMOS QUALQUER MARCA DE VEÍCULO ESPERAMOS UM MÍNIMO DE RESPEITO COM O CONSUMIDOR.

A reclamação não refere-se apenas ao reparo do veículo (estando o mesmo no período de garantia), mas sim ao ressarcimento dos gastos gerados pelo não funcionamento do veículo, vendido pela concessionária ROMA PEUGEOT, que apresentou problemas desde o momento que foi retirado da concessionária e notificado a senhora Suzana. 
Destacamos que o nosso veículo foi removido da garagem da nossa residência no dia 21/01/2017 via PEUGEOT ASSISTENCE EM DIREÇÃO à RUA URUGUAI Nº 144 – ANDARAI – ROMA PEUGEOT, a fim de receber o diagnóstico e reparos, porém devido à falta de comunicação o nosso carro não foi aceito pela concessionária ROMA PEUGEOT. Desta forma, o nosso veículo foi encaminhado para a base da PEUGEOT ASSISTENCE SEM A NOSSA AUTORIZAÇÃO E SEM AO MENOS SABER O LOCAL DESTA BASE. SÃO VÁRIOS OS ERROS QUE A PRÓPRIA PEUGEOT COMETE INTERNAMENTE E PRINCIPALMENTE COM O CLIENTE QUE É OBRIGADO A TER CUSTOS E IMPREVISTOS NO PERÍODO DAS SUAS FÉRIAS.
O reparo do veículo é obrigatório, pois o mesmo encontra-se em garantia e desta forma a PEUGEOT NÃO FAZ MAIS QUE A OBRIGAÇÃO DE REPARÁ-LO E APRESENTAR O LAUDO PARA TODOS OS ITENS QUESTIANOS PELO CONSUMIDOR, POIS NÃO TENHO MAIS SEGURANÇA EM VIAJAR COM ESTE VEÍCULO.

A reclamação não refere-se apenas ao reparo do veículo (estando o mesmo no período de garantia), mas sim ao ressarcimento dos gastos gerados pelo não funcionamento do veículo, vendido pela concessionária ROMA PEUGEOT, que apresentou problemas desde o momento que foi retirado da concessionária e notificado a senhora Suzana. 
Destacamos que o nosso veículo foi removido da garagem da nossa residência no dia 21/01/2017 via PEUGEOT ASSISTENCE EM DIREÇÃO à RUA URUGUAI Nº 144 – ANDARAÍ – ROMA PEUGEOT, a fim de receber o diagnóstico e reparos, porém devido à falta de comunicação o nosso carro não foi aceito pela concessionária ROMA PEUGEOT. Desta forma, o nosso veículo foi encaminhado para a base da PEUGEOT ASSISTENCE SEM A NOSSA AUTORIZAÇÃO E SEM AO MENOS SABER O LOCAL DESTA BASE. SÃO VÁRIOS OS ERROS QUE A PRÓPRIA PEUGEOT COMETE INTERNAMENTE E PRINCIPALMENTE COM O CLIENTE QUE É OBRIGADO A TER CUSTOS E IMPREVISTOS NO PERÍODO DAS SUAS FÉRIAS.
O reparo do veículo é obrigatório, pois o mesmo encontra-se em garantia e desta forma a PEUGEOT NÃO FAZ MAIS QUE A OBRIGAÇÃO DE REPARÁ-LO E APRESENTAR O LAUDO PARA TODOS OS ITENS QUESTIONADOS PELO CONSUMIDOR, POIS NÃO TENHO MAIS SEGURANÇA EM VIAJAR COM ESTE VEÍCULO.

Observação: A Peugeot Brasil (PSA) dá a mínima para o cliente, pois preocupa-se apenas em vender o veículo e o pós venda é péssimo. Todo o conteúdo da reclamação inicial já foi emitida para a Peugeot na França. A reclamação não refere-se apenas ao reparo do veículo (estando o mesmo no período de garantia), mas sim ao ressarcimento dos gastos gerados pelo não funcionamento do veículo, vendido pela concessionária ROMA PEUGEOT, que apresentou problemas desde o momento que foi retirado da concessionária e notificado a senhora Suzana. 
Destacamos que o nosso veículo foi removido da garagem da nossa residência no dia 21/01/2017 via PEUGEOT ASSISTENCE EM DIREÇÃO à RUA URUGUAI Nº 144 – ANDARAÍ – ROMA PEUGEOT, a fim de receber o diagnóstico e reparos, porém devido à falta de comunicação o nosso carro não foi aceito pela concessionária ROMA PEUGEOT. Desta forma, o nosso veículo foi encaminhado para a base da PEUGEOT ASSISTENCE SEM A NOSSA AUTORIZAÇÃO E SEM AO MENOS SABER O LOCAL DESTA BASE. SÃO VÁRIOS OS ERROS QUE A PRÓPRIA PEUGEOT COMETE INTERNAMENTE E PRINCIPALMENTE COM O CLIENTE QUE É OBRIGADO A TER CUSTOS E IMPREVISTOS NO PERÍODO DAS SUAS FÉRIAS.
O reparo do veículo é obrigatório, pois o mesmo encontra-se em garantia e desta forma a PEUGEOT NÃO FAZ MAIS QUE A OBRIGAÇÃO DE REPARÁ-LO E APRESENTAR O LAUDO PARA TODOS OS ITENS QUESTIONADOS PELO CONSUMIDOR, POIS NÃO TENHO MAIS SEGURANÇA EM VIAJAR COM ESTE VEÍCULO.

Espero que a Peugeot chame a min e minha esposa para conversa e propor algum acordo, pois não tenho confiança neste carro PEUGEOT 208 GRIFFE AUTOMÁTICO 2016/2017, QUE AOS 38 DIAS DE RETIRADO DA CONCESSIONÁRIA PAROU DE FUNCIONAR, OU SEJA O MOTOR NÃO DAVA A PARTIDA E APRESENTAVA A MENSAGEM DE DEFEITO NO MOTOR. COM ISSO FORAM GERADOS CUSTOS QUE NÃO ESTAVAM PREVISTOS, POIS QUANDO COMPRAMOS UM CARRO 0 KM NÃO ESPERAMOS LIGAR O CARRO COM 38 DIAS E O MESMO NÃO FUNCIONAR. NÃO TENHO MAIS CONFIABILIDADE NESTE CARRO. CASO EU FAÇA UMA VIAGEM LONGA COMO DE COSTUME COM A MINHA ESPOSA PARA OUTRO PAÍS E VENHA ACONTECER ALGUMA ANORMALIDADE EM UM LUGAR DESERTO, COMO A PEUGEOT IRÁ SE COMPORTAR? SEGURANÇA DO USUÁRIO ACIMA DE TUDO E ESSE CARRO NÃO NOS TRANSMITE MAIS NENHUM TIPO DE SEGURANÇA.

Atenciosamente,
Carlos",complaint,0,COMPLAINT,y-i90CDCumbiQLMC,PSA Peugeot Citroen,psa-peugeot-citroen,http://www.psa-peugeot-citroen.com.br,"['Fabricantes de Carros', 'Problemas com o Atendimento']"
SCcBCfWVGNf5H8f8,2017-03-24,Concessionária Roma Peugeot (Rua Uruguai - Rio de Janeiro) se nega a ressarcir prejuízos por ela causados ao consumidor.,Rio de Janeiro,RJ,Problema mecânico,False,"EMPRESA DE FUNDO DE QUINTA, TRATA-SE SEUS CLIENTES COMO [Editado pelo Reclame Aqui]... VÃO LONGE ASSIM...",interaction,1,FINAL_ANSWER,y-i90CDCumbiQLMC,PSA Peugeot Citroen,psa-peugeot-citroen,http://www.psa-peugeot-citroen.com.br,"['Fabricantes de Carros', 'Problemas com o Atendimento']"
-qUSZlFk-KXesFqk,2022-03-13,Parcelamento de fatura,São Paulo,SP,Renegociação de dívida,False,"Nunca fui de atrasar faturas e sempre tive bom relacionamento com a Porto Seguro cartões, infelizmente sofri um revez financeiro nos últimos meses e acabei atrasando e entrando no parcelamento de fatura. Infelizmente está ficando inviável pagar mesmo os parcelamentos pois os valores só crescem e acabo quitando apenas juros. Tentei contato via chat e não consegui retorno, todos os cartões oferecem uma negociação do valor total devido, mas essa opção não é oferecida pela Porto. Não quero ficar em atraso, mas dessa forma fica quase impossível manter os pagamentos. ",complaint,0,COMPLAINT,-qUSZlFk-KXesFqk,Porto Seguro Cartões e Financiamentos ,portoseg-s-a-credito-financiamento-e-investimento,http://www.portoseguro.com.br,"['Financeiras', 'Seguradoras']"
lo4X1q_i9UieSfQi,2022-03-24,Parcelamento de fatura,São Paulo,SP,Renegociação de dívida,False,"Olá Henrique, 

Em atenção à sua mensagem, entramos em contato nos telefones que constam em registro, celulares finais 02, 45 e 00, porém não obtivemos êxito. Após análise, será possível fazermos em exceção um acordo do saldo total do cartão. Neste caso, pedimos por gentileza, nos contatar através do telefone que informamos na mensagem que enviamos ao seu e-mail privativo. Assim faremos a simulação do acordo. 

Atenciosamente, 

Porto Seguro Cartões: 0800 727 2769 Central de Atendimento: 4004-3600 (Capitais), 0800 727 7477 (Demais Regiões) Para conversar com a Assistente Virtual Porto Seguro via WhatsApp, poderá adicionar o número 11 3003 9303 em sua agenda e iniciar uma conversa! (Atenção, nosso número não possui o 9 na frente, salve-o nesse formato). www.cartaoportoseguro.com.br ATENÇÃO: A Porto Seguro não solicita a senha do seu cartão e Portal do cliente em nenhuma ocasião e nunca retira o cartão em sua residência e/ou solicita o envio do cartão por correio. Fique atento!",interaction,1,ANSWER,-qUSZlFk-KXesFqk,Porto Seguro Cartões e Financiamentos ,portoseg-s-a-credito-financiamento-e-investimento,http://www.portoseguro.com.br,"['Financeiras', 'Seguradoras']"
LBjAILe-BNS5syF6,2022-04-01,Negativaçao indevida,São José dos Campos,SP,SPC-Serasa,False,"Tem uma negativaçao no meu nome na serasa pela caixa, já paguei essa dívida a mais de um mês, e agora foi acrescentada mais um valor a minha duvida de uma prestação que também está paga, já entrei em contato com a caixa, que disse já ter enviado solicitação pra serasa retirar a negativaçao há mais de quinze dias e nada da serasa de retirar, não sei mais o que fazer isso está me prejudicando muito.",complaint,0,COMPLAINT,LBjAILe-BNS5syF6,Serasa,serasa,http://www.serasaconsumidor.com.br,"['Sites e portais', 'Financeiras', 'Contact Center']"
KGo0hq8d0AgXpLDO,2022-04-01,Negativaçao indevida,São José dos Campos,SP,SPC-Serasa,False,"Olá, Patrícia!

Respondemos o seu questionamento através do e-mail que você cadastrou no Reclame Aqui. Caso não tenha mais acesso, recomendamos que atualize os dados no site para visualizar o nosso retorno.

Se preferir, estamos disponíveis também nos canais:
Facebook - www.facebook.com/serasa.com.br/
Central de ajuda - https://ajuda.serasa.com.br
Central de atendimento ao consumidor - 3003-6300 (Segunda à sexta-feira - 08h00 às 20h00).

Qualquer dúvida, conte com a gente!
Equipe Serasa.",interaction,1,ANSWER,LBjAILe-BNS5syF6,Serasa,serasa,http://www.serasaconsumidor.com.br,"['Sites e portais', 'Financeiras', 'Contact Center']"
8ipGdM5KpI4MmG22,2019-05-08,Calculam errado e reduzem o status,São Paulo,SP,Outro problema,False,"Durante 2018 houve muitos problemas de credito de milhas. Calcularam errado os acumulos e baixaram o status de Gold para Silver. Reclamei diversas vezes por telefone, enviamos diversos emails e ninguem mais responde ou atende...Lamentável",complaint,0,COMPLAINT,8ipGdM5KpI4MmG22,Avianca - TACA,avianca-taca,http://www.avianca.com,"['Companhias Aéreas', 'Problemas com o Site']"
8d65MJ6gEr1-SNvz,2019-05-09,Calculam errado e reduzem o status,São Paulo,SP,Outro problema,False,"Prezado Sr,


Agradecemos a mensagem recebida através do Reclame Aqui.

Nosso compromisso é trabalhar constantemente para que nossos clientes utilizem o melhor transporte aéreo internacional, com alto padrão de serviço, conforto e bom atendimento e por isso, sua opinião é muito importante para nós.

Agradecemos o seu contato e informamos que sua reclamação está em tratativa junto ao setores envueltos, entraremos em contato em breve para posicionálo (la).

Em caso de duvidas estamos a sua disposição para atendê-la sempre que necessário.

- Ligação Gratuita: 0800 891 8668.

- Atendimento a Deficientes Auditivos (ligação gratuita): 0800 891 1684.

- site: www.avianca.com  opção Contate-nos.",interaction,1,ANSWER,8ipGdM5KpI4MmG22,Avianca - TACA,avianca-taca,http://www.avianca.com,"['Companhias Aéreas', 'Problemas com o Site']"
Z-fKlKvieGlA55wl,2019-05-13,Calculam errado e reduzem o status,São Paulo,SP,Outro problema,False,Não deram qualquer solução. Pediram para mandar email novamente ao canal que já enviei email 3x.,interaction,2,FINAL_ANSWER,8ipGdM5KpI4MmG22,Avianca - TACA,avianca-taca,http://www.avianca.com,"['Companhias Aéreas', 'Problemas com o Site']"
