id,data_criacao,titulo,cidade,estado,tipo_problema,resolvido:bool,conteudo,tipo_postagem,ordem_da_interacao,tipo_interacao,id_pai,nome_completo_empresa,nome_curto_empresa,site_empresa,categoria_empresa
UZ5MIJj3A_dgA7p1,2021-04-06,A Faculdade não emite certificado,Santo André,SP,Espera extremamente longa para emissão de certificados ,True,"Entrei em contato por telefone  com uma funcionária que foi muito atenciosa, agora estou aguardando o prazo de 10 dias para conclusão do caso.",interaction,4,FINAL_ANSWER,V4OwtpcA9cbf9aDL,Faculdade Campos Elíseos,faculdade-campos-eliseos,,['Universidades e Faculdades']
wa2SFJ7wX2OwuXZt,2021-04-06,A Faculdade não emite certificado,Santo André,SP,Espera extremamente longa para emissão de certificados ,True,"Muito obrigada pela sua opinião, saiba que isso nos ajuda a saber onde devemos melhorar.

Continuo a disposição.

Marcela Pereira",interaction,5,COMPANY_FINAL_ANSWER,V4OwtpcA9cbf9aDL,Faculdade Campos Elíseos,faculdade-campos-eliseos,,['Universidades e Faculdades']
u3N2XNwBJebQKQMa,2022-04-07,Empresa Ruim que não respeita seus clientes ,Boa Vista,RR,,False,"No rastreio o entregador diz que o endereço não existe, mentira o meu endereço é o mesmo e recebo minhas encomendas, só nesta empresa que já tem esse histórico péssimo que não consegue entregar uma encomenda em um endereço tão fácil",complaint,0,COMPLAINT,u3N2XNwBJebQKQMa,Total Express,total-express-tex-courier,http://www.totalexpress.com.br,['Logística e Entrega Rápida']
j0qBcDpljKkR0HQD,2022-04-08,Empresa Ruim que não respeita seus clientes ,Boa Vista,RR,,False,"Olá Joatam, boa tarde!

Referente sua reclamação, esclarecemos que seu endereço de entrega não é atendido na abrangência da base local, a loja está ciente disto, pois recebem a nossa abrangência mensalmente. Desta forma, os serviços contratados pela loja em que finalizou a compra, são de modulo redespacho pelos Correios.

Sua encomenda da AMAZON  ficará disponível para retirada na agência local da sua região, o prazo para comparecimento até agência são de até 7 dias corridos, após este prazo encomenda será devolvida ao remetente.

Poderá acompanhar todo o trajeto pelo site dos correios ( https://rastreamento.correios.com.br/) utilizando o N.° do Redespacho/ Código do Objeto : informado via mensagem privada.

*Obs: As mensagens privadas são enviadas ao e-mail cadastrado no Reclame Aqui.

N.° do Redespacho/ Código do Objeto está disponível em nosso rastreamento da Total Express (https://tracking.totalexpress.com.br/), para visualiza-lo basta clicar na opção Detalhes.

Declaro que  O SAC (Serviço de Atendimento ao Cliente) da Total Express é exclusivo para atendimento aos nossos clientes Corporativos (contratantes dos nossos serviços). O Atendimento ao Consumidor (destinatários finais) deve ser feito com exclusividade pelo SAC da loja virtual onde foi feita a compra.

Aproveito para ratificar nossas sinceras desculpas pelo ocorrido e permanecemos à sua disposição

Atenciosamente,
Equipe Total Express",interaction,1,ANSWER,u3N2XNwBJebQKQMa,Total Express,total-express-tex-courier,http://www.totalexpress.com.br,['Logística e Entrega Rápida']
cmTl89sy9Nz8HGZv,2022-04-08,Empresa Ruim que não respeita seus clientes ,Boa Vista,RR,,False,"MINHA ENCOMENDA FOI Devolvida HOJE DE MANHÃ PARA MANAUS POR FALTA DO ENDEREÇO COMPLETO QUE SERIA ......Rua Manoel Felipe número 539 APARTAMENTO 02, Bairro Buritis- Estado Roraima, cidade Boa Vista cep: 69309170",interaction,2,REPLY,u3N2XNwBJebQKQMa,Total Express,total-express-tex-courier,http://www.totalexpress.com.br,['Logística e Entrega Rápida']
EWUbsu5US_FvPUBt,2022-04-06,Compra cancelada indevidamente e restituição valor cupom e cashback,Cuiabá,MT,Estorno do valor pago,False,"Relato que no dia 31/03/2022 realizei a compra de 01 (um) pacote de fraldas Pampers Confort Sec Mega, Tamanho M, 44 unidades e 01 (um) pacote de fraldas Pampers Premium Care, Tamanho G, 30 unidades, conforme pedido n 02-937246215 no aplicativo da Americanas, utilizando um 01 (um) cupom de desconto de nome BEBE20 no valor de R$20,00 (vinte reais), conforme print em anexo, também utilizei o valor de R$23,46 (vinte e três reais e quarenta e seis centavos) referente ao cashback da AME (OBS: Não consigo tirar print na AME, o app não permite). A entrega era para ser realizada no dia 01/04/2022, porém o produto não foi entregue. Sendo assim, entrei em contato com a Americanas conforme protocolos de ns 322204011418632 e 322204011593148, e para minha surpresa, me informaram que a compra foi cancelada, ou seja, além da compra que eu fiz não ter sido entregue (precisava dos produtos para dar de presente para um amigo num chá de fraldas), também perdi meu cupom e meu cashback. No primeiro atendimento, a atendente me disse que não poderia fazer nada. Indignado com a situação, entrei em contato novamente e a outra atendente disse que ia verificar o meu caso.
Isto posto, solicito o reembolso dos valores utilizados, ou seja, cupom de R$20,00 (vinte reais) mais o cashback da compra. ",complaint,0,COMPLAINT,EWUbsu5US_FvPUBt,Americanas Marketplace,americanas-marketplace,http://www.americanas.com.br,"['Marketplace', 'Higiene e Limpeza Pessoal', 'Higiene e limpeza doméstica', 'Higiene Bucal', 'Utilidades domésticas', 'Acessórios para Carros', 'Acessórios para Celulares, Tablets e Computadores', 'Óculos, Lentes e Acessórios', 'Relógios', 'Jóias e Relojoarias', 'Acessórios de Vestuário', 'Informática', 'Eletroeletrônicos', 'Eletrodomésticos', 'Cama, Mesa e Banho', 'Livros', 'Corpo e Banho', 'Corpo e Banho Infantil', 'Moda Feminina', 'Moda Masculina', 'Moda Infantil', 'Calçados Masculinos', 'Calçados Femininos', 'Calçados Infantis', 'Calçados Esportivos']"
K37pKkGYsPyPyhTg,2022-04-07,Compra cancelada indevidamente e restituição valor cupom e cashback,Cuiabá,MT,Estorno do valor pago,False,"Olá Fábio 
Bom dia!

Referente a sua solicitação de informações  de seu pedido, segue retorno através de mensagem privada.

Serviço de Atendimento ao Cliente
Marolí Silva  Atendimento Especial/RA - Americanas.com
Segunda a Sexta das 08:00 ás 17:30",interaction,1,ANSWER,EWUbsu5US_FvPUBt,Americanas Marketplace,americanas-marketplace,http://www.americanas.com.br,"['Marketplace', 'Higiene e Limpeza Pessoal', 'Higiene e limpeza doméstica', 'Higiene Bucal', 'Utilidades domésticas', 'Acessórios para Carros', 'Acessórios para Celulares, Tablets e Computadores', 'Óculos, Lentes e Acessórios', 'Relógios', 'Jóias e Relojoarias', 'Acessórios de Vestuário', 'Informática', 'Eletroeletrônicos', 'Eletrodomésticos', 'Cama, Mesa e Banho', 'Livros', 'Corpo e Banho', 'Corpo e Banho Infantil', 'Moda Feminina', 'Moda Masculina', 'Moda Infantil', 'Calçados Masculinos', 'Calçados Femininos', 'Calçados Infantis', 'Calçados Esportivos']"
fFI0k1cS9QhrMK8D,2022-04-30,Bolinho Ana Maria seco,Rio de Janeiro,RJ,,False,"Boa tarde. Sempre comprei o bolinho Ana Maria (que por sinal barato não está) sem recheio algum. 
Segue em anexo as fotos.
",complaint,0,COMPLAINT,fFI0k1cS9QhrMK8D,Bimbo do Brasil - Pullman - Plus Vita - Nutrella  - Ana Maria - Crocantíssimo -  Rap 10,bimbo-do-brasil,http://www.grupobimbo.com.br,"['Padaria', 'Alimentos Diet e Light']"
g5UfQJHlhFbkeBmr,2022-05-02,Bolinho Ana Maria seco,Rio de Janeiro,RJ,,False,"PROTOCOLO 222909
Olá LETÍCIA!
Agradecemos mais uma vez a atenção.
Formalizamos o contato realizado via telefone e todas as explicações foram passadas.
Caso haja alguma dúvida, deixamos a disposição os seguintes canais para contato: e-mail sac@grupobimbo.com e o nosso WhatsApp 11 99243-8241.
Acreditamos que todas as manifestações de nossos consumidores são excelentes oportunidades, para melhorar ainda mais a qualidade dos produtos que oferecemos.
Desejamos que os produtos da Bimbo continuem trazendo alegria e sabor à sua mesa.
Abraço, 
Equipe Bimbo Brasil",interaction,1,ANSWER,fFI0k1cS9QhrMK8D,Bimbo do Brasil - Pullman - Plus Vita - Nutrella  - Ana Maria - Crocantíssimo -  Rap 10,bimbo-do-brasil,http://www.grupobimbo.com.br,"['Padaria', 'Alimentos Diet e Light']"
BFUFyMUiTUtgEs51,2021-02-25,Divergência no contrato e a cobrança indevida,Mauá,SP,Cobrança indevida,False,"Fiz a solicitação pelo aplicativo de um aluguel de moto em um plano de 3 meses. E quando eu fui devolver a moto no dia 24/02 fui informado que estava com um plano de 2 anos e a taxa da quebra do contrato seria 10x de 500 reais.
Tenho os prints do plano de 3 meses e dos pagamento que eu paguei referente ao 3 meses. E vocês mudaram o meu contrato para dois anos sem a minha autorização conforme o último anexo.
Ja tentei resolver essa situação pelo Whatsapp sem envolver com um processo Judicial, mais vocês negaram resolver disseram que eu estava ciente e eu não confirmei em momento nenhum essa mudança de 3 meses para dois anos tenhos prints da conversa e tenho uma testemunha que estava comigo no dia que fui retirar a moto pela Mottu.",complaint,0,COMPLAINT,BFUFyMUiTUtgEs51,Mottu,mottu,http://mottu.com.br,['Aluguel de Carros']
abNr5vnKAQrNafbg,2021-03-11,Divergência no contrato e a cobrança indevida,Mauá,SP,Cobrança indevida,False,"Olá Arlem, 

Conforme conversado via suporte e presencialmente, desde o começo o plano contratado havia sido o Minha Mottu e já foram pagas 7 parcelas so respectivo plano, como consta no sistema. Caso deseje, entre em contato com o Time de Suporte para esclarecermos e sanarmos possíveis dúvidas.",interaction,1,ANSWER,BFUFyMUiTUtgEs51,Mottu,mottu,http://mottu.com.br,['Aluguel de Carros']
8NjY6JeBQs-cqg_U,2021-03-11,Divergência no contrato e a cobrança indevida,Mauá,SP,Cobrança indevida,False,Tenho provas suficientes que eu não sabia desse acordo que vocês colocaram em meu contrato e ainda fizeram uma assinatura falsificada bom se não quiser resolver numa boa eu vou entrar com um processo Judicial tenho provas nas minhas msg do whats e tenho testemunha. Eu vou procurar os meu direitos NÃO RECOMENDO ESSA EMPRESA PARA NINGUÉM E VOCÊS NÃO SABEM RESOLVER AS COISAS,interaction,2,REPLY,BFUFyMUiTUtgEs51,Mottu,mottu,http://mottu.com.br,['Aluguel de Carros']
0pAjpsmNfU0XVZd3,2022-03-21,Propaganda via SMS,Leme,SP,Propaganda abusiva,False,"Tenho recebido com frequência propaganda de cartão de crédito do C6 Bank via SMS e gostaria q isto parasse.
Datas:
21/mar - 14h08
17/mar - 09h56
10/mar - 16h06
03/mar - 09h59
16/fev - 16h39
",complaint,0,COMPLAINT,0pAjpsmNfU0XVZd3,Tim Celular,tim-celular,http://www.tim.com.br,"['Celulares e Smartphones', 'Telefonia fixa', 'Telefonia celular', 'Provedores e serv. de internet']"
-EVQ0bWZ2r31t8Uq,2022-03-25,Propaganda via SMS,Leme,SP,Propaganda abusiva,False,"Olá,  Davi

Conforme falamos em 25/03/2022 através de telefone, sua reclamação a respeito de mensagens publicitárias foi solucionada e o detalhamento pode ser acessado através das mensagens privadas, pois, como a plataforma do Reclame Aqui é pública prezamos pela segurança dos seus dados.

Temos como prioridade oferecer aos nossos clientes os melhores serviços, atendimento e experiências inovadoras com transparência nas relações.

A TIM lamenta qualquer falha anterior a este atendimento e reforça o compromisso com a satisfação e experiência de nossos clientes.  

Caso necessite de nosso suporte além deste canal, disponibilizamos atendimento através da nossa central telefônica *144 (ligando de um número TIM), 1056 (de qualquer número), ou no nosso site www.tim.com.br.
 
Abraços,
Equipe TIM",interaction,1,ANSWER,0pAjpsmNfU0XVZd3,Tim Celular,tim-celular,http://www.tim.com.br,"['Celulares e Smartphones', 'Telefonia fixa', 'Telefonia celular', 'Provedores e serv. de internet']"
XB4zItY38TJ23TbZ,2022-04-05,Aumento de limite do cartão ,Feira de Santana,BA,,False,Venho aqui.prestar minha indignação.  Uso bastante o cartão.  Pago boleto no app.  Faço movimentações e até hj vc n me deram aumento de limite do cartão.  Só.tube uma vez tanto tempo ,complaint,0,COMPLAINT,XB4zItY38TJ23TbZ,Mercado Pago,mercado-pago,http://www.mercadopago.com,"['Meios de pagamentos eletrônicos', 'Problemas com o Atendimento', 'Ecommerce Local', 'Diversos', 'Equipamentos de Beleza e Estética']"
9l01iG9Z7Oe2Bkq8,2022-04-06,Aumento de limite do cartão ,Feira de Santana,BA,,False,"Ola. Adriana!

Recebemos a sua solicitação e vamos te passar algumas informações importantes, tudo bem!?

Entendemos a seu ponto de vista e estamos aqui para lhe orientar melhor sobre o que aconteceu com a sua proposta do Mercado Crédito!
O limite do Mercado Crédito aumenta conforme sua movimentação na plataforma, ou seja, quanto mais conhecemos o seu perfil, maiores são as chances deste limite aumentar.

Constantemente o Mercado Pago realiza análises internas para cada cliente, quando conseguimos modificar a uma proposta de limite, sempre te informaremos por e-mail e notificações na sua conta. Não precisa se preocupar que essa análise é automática, tudo bem?

Daremos algumas dicas de como movimentar sua conta e ganhar visibilidade no nosso sistema:

- Realizar o pagamento das parcelas do Mercado Crédito até o vencimento;
- Movimentar mais a conta do Mercado Pago com transferências (TED ou Pix);
- Realizar pagamento de contas, recarga de celular, transferências, pagamento com QR code e outras transações pelo Mercado Pago;
- Manter sempre o pagamento em dia de outras contas (água, luz, financiamento e etc) vinculados ao seu CPF.

Você é muito importante para nós! Saiba que estamos aqui para te proporcionar cada vez mais a melhor experiência no site.

Sempre que precisar de ajuda, por favor, entre em contato por meio dos nossos canais oficiais, temos um time especializado que irá te atender com todo prazer.

Atenção ao Cliente.
Mercado Pago.",interaction,1,ANSWER,XB4zItY38TJ23TbZ,Mercado Pago,mercado-pago,http://www.mercadopago.com,"['Meios de pagamentos eletrônicos', 'Problemas com o Atendimento', 'Ecommerce Local', 'Diversos', 'Equipamentos de Beleza e Estética']"
-v1-b5u94eanPiyc,2020-09-15,"Meus pneus sofreram delaminações, picotamentos e arranchamentos",São José dos Campos,SP,Rasgado,True,"Bom dia 
Mediante que está acontecendo em meu veículo tracker 1.8 2014/2015 Meus pneus sofreram delaminações, picotamentos e arranchamentos. já levei o carro na autorizada de vocês para que se faça a avaliação dos pneus medias PNEU 215/55R18 CONTIPROCONTACT CONTINENTAL 94H
Atendimento aberto por telefone aguardando posição 
Beatriz 
protocolo do atendimento 9082. Ouvidoria .

BOM VAMOS LÁ  FIZ RECLAMAÇÃO NESSE MESMO MEIO DE CANAL, E CONSEGUI TROCAR 2 PNEUS SENDO QUE ESTÁ AINDA NA GARANTIA  MANDEI PARA LAUDO NO IMPÉRIO 7 EM SJC  , FAZENDO  ANALISE TÉCNICA PARA ENVIO PARA FABRICA E CONSTANDO QUE ESTAVAM OS 4 COM MESMO PROBLEMA DE FABRICAÇÃO SENDO ASSIM A CONTINENTAL TROCOU APENAS 2 ALEGANDO QUE OS OUTROS NÃO IRIAM DAR PROBLEMA VENHO AQUI PARA DEIXAR MINHA  QUEIXA  DE PERDA DE TEMPO E DINHEIRO PQ OS OUTROS 2 PNEUS QUE ALEGARAM QUE NÃO IAM DAR PROBLEMA DEU.

DE NOVO PERDI TEMPO LEVANDO NA AUTORIZADA JÁ FIZ O LAUDO CONSTANDO PROBLEMAS E  SENDO ASSIM PERDENDO ALINHAMENTO E BALANCEAMENTO E CAMBAGEM QUE TINHA FEITO POR MOTIVOS QUE ALEGARAM QUE SÓ TINHA 2 PNEUS COM PROBLEMA AGORA MORRI COM  A MANUTENÇÃO FEITA PQ O PROBLEMA VOLTOU ESTOU AGUARDANDO POSIÇÃO.

E NÃO IREI ARCAR COM NENHUM REAL DE MANUTENÇÃO SENDO QUE FOI ERROS DA GARANTIA EM NÃO TROCAR OS 4 JÁ.

EM ANEXO APENAS ALGUMAS FOTOS QUE EU TIREI 

SOU ÚNICO DONO DO VEICULO.
tenho nota fiscal de compra e tudo que a continental pede.
aguardo posição.",complaint,0,COMPLAINT,-v1-b5u94eanPiyc,Continental Pneus,continental-pneus,http://ajuda.conti.com.br,['Pneus']
nR8ydGQDNPPt76op,2020-10-26,"Meus pneus sofreram delaminações, picotamentos e arranchamentos",São José dos Campos,SP,Rasgado,True,"Boa Tarde ainda estou na faze de teste e aguardando para ver se aparece alguma anomalias no pneus, pois trocaram por outro modelo e vi que tem algumas queixas sobre pneus colocados no lugar como garantia pois não me deram escolha  para pelo menos ver se estes são os ideias para condições que uso ou de nosso pais.",interaction,1,FINAL_ANSWER,-v1-b5u94eanPiyc,Continental Pneus,continental-pneus,http://ajuda.conti.com.br,['Pneus']
vKzjeRidtv2sgVjM,2022-04-05,Limite ,Olinda,PE,Limite ,False,"Boa Noite tenho score 608 boa vista , Serasa 478 não tenho nome sujo , e o banco neon apenas me dá cartão de débito , estou decepcionado com o banco ..! Ou corrijam essa análise ou irei encerrar a conta ..! Acho que o banco não estão dando atenção para seus clientes ",complaint,0,COMPLAINT,vKzjeRidtv2sgVjM,Neon Pagamentos,banco-neon,http://www.neonpagamentos.com.br,"['Cartões de Crédito', 'Bancos', 'Internet Banking', 'Financeiras', 'Factorings', 'Serviços de câmbio e transferência de dinheiro']"
hDALB-BOgb7vH8uP,2022-04-07,Limite ,Olinda,PE,Limite ,False,"Olá, Jailson.

Te enviamos alguns detalhes sobre a resolução do seu caso nas mensagens privadas, tudo bem? Você pode visualizar no seu e-mail cadastrado no Reclame Aqui pesquisando por Hugme ou Reclame Aqui.

Qualquer coisa pode nos contatar nos seguintes canais oficiais:
- Estamos 24h por dia disponíveis no chat, que você pode acessar pelo próprio aplicativo
- E-mail (oi@neon.com.br/oipejota@neon.com.br)
- E nossas redes sociais

Time Neon.",interaction,1,ANSWER,vKzjeRidtv2sgVjM,Neon Pagamentos,banco-neon,http://www.neonpagamentos.com.br,"['Cartões de Crédito', 'Bancos', 'Internet Banking', 'Financeiras', 'Factorings', 'Serviços de câmbio e transferência de dinheiro']"
L3vn1P8SqRRGJrFT,2020-12-15,Pneu deformado de péssima qualidade/ Continental faz análise superficial do pneu através de fotos,Rio de Janeiro,RJ,Gasto,True,"Em 12/04/2017 foi realizada a compra de um veículo Nissan Versa SL Unique, na concessionária Dinisa Niterói, efetuando o pagamento da quantia R$ 67.520,00. Ocorre que após a data da garantia de Fábrica, 3 anos, um dos pneus apresentou uma grande deformação comprometendo a segurança da família. Conforme orientado pela própria Nissan, foi feito o contato com a empresa Continental Pneus, cuja a garantia são de 5 anos, e foi encaminhado fotos para a análise técnico, tendo havido o registro do problema sob protocolo n 15656. Após análise técnica, sob ordem serviço n 6251172602, foi constatado que a deformidade do pneu foi por conta de problemas mecânicos, se recusando a efetuar a troca do pneu ainda em garantia. Ocorre que a análise foi feito somente por mera foto e que não dá para precisar a deformidade apresentada. Foi solicitada a análise pessoalmente e foi recusada pela empresa sem motivo algum. Cabe salientar que o veículo está com apenas 37000km, sob excelentes cuidados, e que a deformidade apresentou em somente 1 pneu.",complaint,0,COMPLAINT,L3vn1P8SqRRGJrFT,Continental Pneus,continental-pneus,http://ajuda.conti.com.br,['Pneus']
6GyzEckO4VUo8zl1,2020-12-16,Pneu deformado de péssima qualidade/ Continental faz análise superficial do pneu através de fotos,Rio de Janeiro,RJ,Gasto,True,"Olá, Allan!

Nossa garantia é de 5 anos contra vícios e falhas na fabricação, a partir da data de compra. 

Verificamos que o processo de análise de garantia de seu pneu foi realizado, através do laudo de nº 6251172602 como não procedente de garantia. 

Estaremos analisando sua contestação junto a Equipe Técnica, e retornamos por e-mail ou telefone. 

Aproveito para informar, que o prazo para reavaliação está em torno de 15 dias úteis.

Qualquer dúvida estou à disposição.

Abraço.

Thais Estringueto
Continental Pneus",interaction,1,ANSWER,L3vn1P8SqRRGJrFT,Continental Pneus,continental-pneus,http://ajuda.conti.com.br,['Pneus']
CjskUURYJfUVoWgv,2020-12-16,Pneu deformado de péssima qualidade/ Continental faz análise superficial do pneu através de fotos,Rio de Janeiro,RJ,Gasto,True,Ok. Aguardo contato.,interaction,2,REPLY,L3vn1P8SqRRGJrFT,Continental Pneus,continental-pneus,http://ajuda.conti.com.br,['Pneus']
ry-KA3-HaWdl-gEN,2021-01-17,Pneu deformado de péssima qualidade/ Continental faz análise superficial do pneu através de fotos,Rio de Janeiro,RJ,Gasto,True,"Passaram-se os 15 dias e não entraram em contato conforme combinado. Parece que a Continental Pneus esta falindo, talvez seja por isso que não estao nem ai para o consumidor.",interaction,3,REPLY,L3vn1P8SqRRGJrFT,Continental Pneus,continental-pneus,http://ajuda.conti.com.br,['Pneus']
loXwAfi3n23GQAOG,2021-01-21,Pneu deformado de péssima qualidade/ Continental faz análise superficial do pneu através de fotos,Rio de Janeiro,RJ,Gasto,True,"Bom dia, Allan!

Tudo bem?

Tentamos contato agora mesmo com você, mas sem sucesso.

Por favor, peço que entre em contato através do 0800 17 000 61 ou nos informe o melhor horário para retornar.

Vale lembrar que nosso horário de atendimento é das 08h30 às 12h00 e das 13h00 às 16h30 de segunda a sexta feira.

Atenciosamente.

Equipe Continental Pneus",interaction,4,COMPANY_REPLY,L3vn1P8SqRRGJrFT,Continental Pneus,continental-pneus,http://ajuda.conti.com.br,['Pneus']
HrHnqsyiMrpBFBvO,2021-01-22,Pneu deformado de péssima qualidade/ Continental faz análise superficial do pneu através de fotos,Rio de Janeiro,RJ,Gasto,True,"Olá, Allan!

Tudo bem? 😊

Primeiramente, pedimos desculpas por qualquer experiência ruim com nossa marca e/ou atendimento recebido.

A nossa intenção é minimizar sua insatisfação e continuar tendo-o como nosso cliente. 

Sendo assim, informo que o processo para substituição de seu pneu está em andamento.

Por favor, pode deixar aqui a sua avaliação referente ao atendimento recebido? =)

Um abraço.

Equipe Continental Pneus",interaction,5,COMPANY_REPLY,L3vn1P8SqRRGJrFT,Continental Pneus,continental-pneus,http://ajuda.conti.com.br,['Pneus']
yVcX2gMeKpWovXNr,2021-01-22,Pneu deformado de péssima qualidade/ Continental faz análise superficial do pneu através de fotos,Rio de Janeiro,RJ,Gasto,True,"Hoje, dia 22/01/2021, a atendente Thais entrou em contato por telefone, oferecendo uma proposta para o caso in tela, troca do pneu, na qual foi aceito. Ressalto a presteza, atenção e a preocupação para com o consumidor em solucionar o caso.",interaction,6,FINAL_ANSWER,L3vn1P8SqRRGJrFT,Continental Pneus,continental-pneus,http://ajuda.conti.com.br,['Pneus']
puiNHl65EAerqCtf,2020-11-23,Estragou com pouco uso,Ouro Branco,MG,Outro problema,True,"Comprei o brinquedo &quot;Jogo Puxa Puxa Batatinha&quot; nas Lojas Americanas para o dia das crianças e mesmo tendo usado poucas vezes, hoje ele parou de funcionar. As peças que precisam encaixar para o brinquedo funcionar não encaixam mais.",complaint,0,COMPLAINT,puiNHl65EAerqCtf,Brinquedos Estrela ,brinquedos-estrela,http://www.estrela.com.br,['Brinquedos e jogos']
1u78nitK3vSzZ8uh,2020-11-27,Estragou com pouco uso,Ouro Branco,MG,Outro problema,True,"Olá Rafael, bom dia.

Agradecemos o seu contato com a Estrela!
Lamentamos que um produto nosso esteja lhe causando qualquer transtorno. Pedimos nossas sinceras desculpas, e prometemos resolver o quanto antes.

Estamos enviando uma mensagem por e-mail, o número do seu protocolo de atendimento é 189740
Conte sempre conosco, 
Centro Estrela de Atendimento ao Consumidor 
facebook.com/BrinquedosEstrela 
www.estrela.com.br",interaction,1,ANSWER,puiNHl65EAerqCtf,Brinquedos Estrela ,brinquedos-estrela,http://www.estrela.com.br,['Brinquedos e jogos']
VPr_Ib-4JUe3KtNT,2021-01-12,Estragou com pouco uso,Ouro Branco,MG,Outro problema,True,A empresa se comprometer de enviar a peça defeituosa em poucos dias. Mas nunca chegou.,interaction,2,REPLY,puiNHl65EAerqCtf,Brinquedos Estrela ,brinquedos-estrela,http://www.estrela.com.br,['Brinquedos e jogos']
_LLoz_OmDkHSG0pI,2021-02-07,Estragou com pouco uso,Ouro Branco,MG,Outro problema,True,Recebi outro brinquedo. Obrigado,interaction,3,FINAL_ANSWER,puiNHl65EAerqCtf,Brinquedos Estrela ,brinquedos-estrela,http://www.estrela.com.br,['Brinquedos e jogos']
15688970,2015-12-03,Não entregaram e nem deram notícias.,Macaé,RJ,Produto não recebido,False,"De presente de aniversário, meu irmão me pergunta o que eu quero. Eu acho lindas DUAS CAMISAS DO STAR WARS no site da Loja Mundo Geek, logo meu irmão efetua a compra (11/11/2015). E agora, com a conta já paga, eles não entregaram e é impossível de entrar em contato com eles.

Só quero minhas camisas, ou o meu dinheiro de volta.",complaint,0,COMPLAINT,15688970,Loja Mundo Geek,loja-mundo-geek,http://www.lojamundogeek.com.br,"['Relógios', 'Acessórios de Vestuário', 'Utilidades domésticas', 'Brinquedos e jogos', 'Material Escolar e Escritórios', 'Moda Infantil', 'Moda Masculina', 'Moda Feminina', 'Maquiagem']"
15688970-ANSWER,2015-12-16,Não entregaram e nem deram notícias.,Macaé,RJ,Produto não recebido,False,"Olá Mateus,



Já fizemos o envio das camisetas e a mesma está a caminho.

Demoramos um pouco nas postagens, devido ao evento da CCXP.



Agradecemos a compreensão. 

Seu irmão vai amar as camisetas.



Abraço.

Atenciosamente,

Loja Mundo Geek",interaction,1,ANSWER,15688970,Loja Mundo Geek,loja-mundo-geek,http://www.lojamundogeek.com.br,"['Relógios', 'Acessórios de Vestuário', 'Utilidades domésticas', 'Brinquedos e jogos', 'Material Escolar e Escritórios', 'Moda Infantil', 'Moda Masculina', 'Moda Feminina', 'Maquiagem']"
